{"authentication_execution_permitted":false,"decision":"NO-GO","errors":[],"freeze_permitted":false,"limitations":["This validator checks a static policy and does not execute Cosign.","No review record, signature bundle, trusted-root bytes, or reviewer credential is authenticated here.","Even successful future authentication cannot establish reviewer competence, care, independence, disclosure truth, or scientific correctness."],"policy_path":"protocol/R0_REVIEWER_IDENTITY_POLICY_TEMPLATE.json","policy_schema_path":"schemas/r0-reviewer-identity-policy.schema.json","policy_schema_sha256":"132ccc1b86b610d43aa2bfecb1d0491344abfefb9d274a9d462b5db3e57bc31a","policy_sha256":"e3cbfac75a115b818d5880a3ad6f3558618d81e1b1e8d074bbfc475e42ebf2c0","policy_status":"template_not_authorized_not_frozen","read_scope":{"authentication_executed":false,"confirmatory_outputs_read":false,"network_used":false,"review_record_read":false,"signature_bundle_read":false},"rg004_complete":false,"schema_version":"amy.r0-reviewer-identity-policy-validation.v1-draft","security_floor_valid":true,"selected_version_not_known_vulnerable":false,"source_basis_complete":true,"source_ledger_sha256":"3009ee06d656e0a705d2cb3eb5cdceda9ede77a81eb68904e3d70d1945dad5ab","valid":true,"validation_schema_path":"schemas/r0-reviewer-identity-policy-validation.schema.json","validation_schema_sha256":"5a05b666f337a5964682ad69ea997412a6d6475ae173e6446ff86108c8b41e2f","validator_sha256":"37b0b5c04307ff6f95e52685d0ceaff193649bd1a2ba915c76558c7581d31c27"}
